{
  "id": "joins",
  "title": "SQL Joins",
  "icon": "🔗",
  "difficulty": "Beginner",
  "duration": "45 min",
  "description": "Combine data from multiple tables",
  "prerequisites": [],
  "nextTopics": ["subqueries", "window-functions"],
  "content": {
    "comicStory": {
      "title": "The Dating App Disaster",
      "panels": [
        {
          "image": "👨‍💼",
          "text": "Meet Bob. He runs a dating app with two databases: one for USERS and one for PROFILES."
        },
        {
          "image": "😰",
          "text": "Problem: Users are complaining they can't see profile pictures! The data is in separate tables."
        },
        {
          "image": "💡",
          "text": "Bob's intern suggests: 'Why don't we just MERGE the tables?' Bob facepalms."
        },
        {
          "image": "🔗",
          "text": "Bob uses INNER JOIN to connect users with their profiles using user_id as the key."
        },
        {
          "image": "😱",
          "text": "TWIST: Half the users disappeared! Turns out, not everyone filled out their profile."
        },
        {
          "image": "✅",
          "text": "Bob switches to LEFT JOIN - now ALL users show up, even without profiles!"
        }
      ],
      "twist": "The wrong JOIN type can make your data vanish! Always think about what you want to keep.",
      "lesson": "JOINs connect tables, but the TYPE of JOIN determines which rows survive."
    },
    "deepDive": {
      "whatItIs": "SQL JOINs combine rows from two or more tables based on a related column between them. Think of it as matching puzzle pieces - you connect tables where certain values match.",
      "whyItMatters": "Real-world data is never in one table. Customer info, orders, products, payments - all separate. JOINs let you see the complete picture by connecting related data.",
      "whereUsed": [
        "E-commerce: Connecting customers with their orders",
        "Banking: Linking accounts with transactions",
        "Social Media: Matching users with their posts and comments",
        "Analytics: Combining sales data with product information",
        "HR Systems: Connecting employees with departments and salaries"
      ],
      "visualExamples": [
        {
          "title": "INNER JOIN - Only Matches",
          "description": "Returns only rows where there's a match in BOTH tables",
          "diagram": "Table A: [1,2,3] ∩ Table B: [2,3,4] = Result: [2,3]"
        },
        {
          "title": "LEFT JOIN - Keep All from Left",
          "description": "Returns ALL rows from left table, matched rows from right (or NULL)",
          "diagram": "Table A: [1,2,3] ← Table B: [2,3,4] = Result: [1,2,3] (1 has NULL from B)"
        },
        {
          "title": "RIGHT JOIN - Keep All from Right",
          "description": "Returns ALL rows from right table, matched rows from left (or NULL)",
          "diagram": "Table A: [1,2,3] → Table B: [2,3,4] = Result: [2,3,4] (4 has NULL from A)"
        },
        {
          "title": "FULL OUTER JOIN - Keep Everything",
          "description": "Returns ALL rows from both tables, with NULLs where no match",
          "diagram": "Table A: [1,2,3] ∪ Table B: [2,3,4] = Result: [1,2,3,4]"
        }
      ],
      "keyPoints": [
        "INNER JOIN = Only matching rows (intersection)",
        "LEFT JOIN = All from left table + matches from right",
        "RIGHT JOIN = All from right table + matches from left",
        "FULL OUTER JOIN = Everything from both tables",
        "JOIN key must exist in both tables",
        "Use table aliases (a, b) for cleaner code",
        "Multiple JOINs can be chained together"
      ]
    },
    "interactiveQA": [
      {
        "question": "What is the main purpose of SQL JOINs?",
        "answer": "To combine data from multiple tables based on related columns.",
        "explanation": "JOINs allow you to retrieve data that's spread across different tables by connecting them through common columns (like user_id, product_id, etc.).",
        "memoryTrick": "Think of JOINs as 'connecting the dots' between related data tables."
      },
      {
        "question": "What's the difference between INNER JOIN and LEFT JOIN?",
        "answer": "INNER JOIN returns only matching rows; LEFT JOIN returns all rows from the left table plus matches from the right.",
        "explanation": "INNER JOIN is strict (both sides must match). LEFT JOIN is lenient (keeps everything from left, even if right side is empty).",
        "memoryTrick": "LEFT JOIN = 'Left side is VIP, they ALL get in, even without a +1'"
      },
      {
        "question": "When would you use a LEFT JOIN instead of INNER JOIN?",
        "answer": "When you want to keep all records from the main table, even if there's no matching data in the joined table.",
        "explanation": "Example: Show all customers, even those who haven't placed orders yet. INNER JOIN would hide customers with no orders.",
        "memoryTrick": "LEFT JOIN = 'Don't leave anyone behind from the left table!'"
      },
      {
        "question": "What is a JOIN key?",
        "answer": "The column(s) used to match rows between tables, typically a foreign key relationship.",
        "explanation": "It's the common column that exists in both tables. Like user_id in both Users and Orders tables.",
        "memoryTrick": "JOIN key = The 'handshake' column that connects two tables"
      },
      {
        "question": "Can you JOIN more than two tables?",
        "answer": "Yes! You can chain multiple JOINs to connect as many tables as needed.",
        "explanation": "Example: Users JOIN Orders JOIN Products JOIN Categories - each JOIN adds another table to the result.",
        "memoryTrick": "JOINs are like LEGO blocks - stack as many as you need!"
      },
      {
        "question": "What happens if the JOIN key has duplicate values?",
        "answer": "You get a cartesian product - each matching row from table A pairs with EVERY matching row from table B.",
        "explanation": "If table A has 3 rows with id=5 and table B has 2 rows with id=5, you get 3×2=6 result rows.",
        "memoryTrick": "Duplicates multiply! 3×2=6 (not 3+2=5)"
      }
    ],
    "codingChallenge": {
      "title": "E-commerce Order Analysis",
      "scenario": "You work for an online store. The manager wants a report showing customer names with their order details. Some customers haven't ordered yet, but should still appear in the report.",
      "dataset": {
        "tables": [
          {
            "name": "customers",
            "columns": ["customer_id", "name", "email"],
            "sampleData": [
              [1, "Alice", "alice@email.com"],
              [2, "Bob", "bob@email.com"],
              [3, "Charlie", "charlie@email.com"],
              [4, "Diana", "diana@email.com"]
            ]
          },
          {
            "name": "orders",
            "columns": ["order_id", "customer_id", "product", "amount"],
            "sampleData": [
              [101, 1, "Laptop", 1200],
              [102, 1, "Mouse", 25],
              [103, 2, "Keyboard", 75],
              [104, 3, "Monitor", 300]
            ]
          }
        ]
      },
      "problem": "Write a query to show ALL customers with their orders. Include customers who haven't ordered anything (show NULL for order details).",
      "expectedOutput": "customer_id | name | order_id | product | amount\n1 | Alice | 101 | Laptop | 1200\n1 | Alice | 102 | Mouse | 25\n2 | Bob | 103 | Keyboard | 75\n3 | Charlie | 104 | Monitor | 300\n4 | Diana | NULL | NULL | NULL",
      "hints": [
        "You need to keep ALL customers, even those without orders",
        "Which JOIN type keeps all rows from the left table?",
        "LEFT JOIN is your friend here!",
        "Syntax: SELECT ... FROM customers LEFT JOIN orders ON ..."
      ],
      "solution": "SELECT \n  c.customer_id,\n  c.name,\n  o.order_id,\n  o.product,\n  o.amount\nFROM customers c\nLEFT JOIN orders o ON c.customer_id = o.customer_id\nORDER BY c.customer_id;",
      "explanation": "We use LEFT JOIN because we want ALL customers (left table) to appear, even if they have no matching orders (right table). Diana appears with NULL values because she hasn't placed any orders yet. If we used INNER JOIN, Diana would disappear from the results!"
    },
    "quiz": [
      {
        "question": "You have a Users table (1000 rows) and a Premium_Users table (200 rows). You want to find all premium users. Which JOIN should you use?",
        "options": [
          "INNER JOIN - only users who are premium",
          "LEFT JOIN - all users, mark who is premium",
          "RIGHT JOIN - all premium users",
          "FULL OUTER JOIN - everyone"
        ],
        "correctAnswer": 0,
        "explanation": "INNER JOIN is correct because you only want users who exist in BOTH tables (i.e., users who are premium). LEFT JOIN would include all 1000 users, which is not what we want.",
        "difficulty": "easy"
      },
      {
        "question": "Your manager wants a report of ALL products, showing sales data if available. Products table has 500 items, Sales table has 300 transactions. What's the result count?",
        "options": [
          "300 rows (only products with sales)",
          "500 rows (all products, some with NULL sales)",
          "800 rows (sum of both tables)",
          "150,000 rows (cartesian product)"
        ],
        "correctAnswer": 1,
        "explanation": "LEFT JOIN from Products to Sales gives 500 rows - one for each product. Products without sales will have NULL in sales columns. This keeps all products visible.",
        "difficulty": "medium"
      },
      {
        "question": "You JOIN Orders and Customers, but get 10,000 rows instead of expected 1,000. What's the likely cause?",
        "options": [
          "The JOIN key has duplicate values in one or both tables",
          "You used the wrong JOIN type",